{
  "schema": "prism.cli.stroke_font_metrics.a0",
  "space_width": 0.7619047619047619,
  "super_sub_size_multiplier": 0.8,
  "advances": {
    "32": 0.7619047619047619,
    "33": 0.47619047619047616,
    "45": 1.2380952380952381,
    "48": 0.9523809523809523,
    "49": 0.9523809523809523,
    "50": 0.9523809523809523,
    "65": 0.8571428571428571,
    "82": 0.9999999999999999,
    "84": 0.7619047619047619,
    "85": 1.0476190476190474,
    "90": 0.9523809523809523,
    "97": 0.9047619047619047,
    "176": 0.7619047619047619,
    "177": 1.2380952380952381,
    "181": 1.0476190476190474,
    "937": 1.1428571428571428,
    "8486": 1.1428571428571428
  }
}
